author,title,description,url,urlToImage,publishedAt,content
finance.yahoo.com,Stock market today: Stocks open mixed as focus turns to inflation data,"US stocks opened mixed on Tuesday, with techs serving as a bright spot while Wall Street kicked off a holiday-shortened week by focusing on a coming inflation report watched closely by the Federal Reserve. The benchmark S&P 500 (^GSPC) was up about 0.2%, whil…",https://biztoc.com/x/600f232cdbe6b976,https://c.biztoc.com/p/600f232cdbe6b976/og.webp,2024-05-28T14:44:10Z,"US stocks opened mixed on Tuesday, with techs serving as a bright spot while Wall Street kicked off a holiday-shortened week by focusing on a coming inflation report watched closely by the Federal Re… [+292 chars]"
aol.com,Stock market today: Nasdaq hits record ahead of new inflation data,"May 28, 2024 at 9:49 AM • None The Nasdaq hit a record in early trading on Tuesday while other indexes were mixed. • None Markets will also digest housing data and revised GDP numbers for the first quarter. Stocks were mixed on Tuesday with the Nasdaq hitting…",https://biztoc.com/x/aff405d53d1b307c,https://c.biztoc.com/p/aff405d53d1b307c/s.webp,2024-05-28T14:40:08Z,"May 28, 2024 at 9:49 AMNone The Nasdaq hit a record in early trading on Tuesday while other indexes were mixed.None Markets will also digest housing data and revised GDP numbers for the first quarter… [+292 chars]"
finance.yahoo.com,"1 Unstoppable Stock That Could Join Nvidia, Microsoft, Apple, Amazon, Alphabet, and Meta in the $1 Trillion Club","The U.S. stock market has demonstrated remarkable resilience and growth over the past decade despite multiple economic challenges and geopolitical pressures. This environment has helped pave the way for high-growth companies such as Nvidia, Apple, Amazon, Alp…",https://biztoc.com/x/c9b3ed1e38734a11,https://c.biztoc.com/p/c9b3ed1e38734a11/s.webp,2024-05-28T14:38:09Z,The U.S. stock market has demonstrated remarkable resilience and growth over the past decade despite multiple economic challenges and geopolitical pressures. This environment has helped pave the way … [+283 chars]
Oliver Haslam,Looking For A Ton Of Spare Batteries? Save 27% On This AA 32-Pack From Energizer Today,"Are you tired of constantly running out of battery power for your remotes, game controllers, and other devices? Now’s the perfect time to stock up on a trusted, reliable power source from a brand you know. Energizer AA Batteries are currently on sale with a h…",https://www.redmondpie.com/looking-for-a-ton-of-spare-batteries-save-27-on-this-aa-32-pack-from-energizer-today/,https://cdn.redmondpie.com/wp-content/uploads/2024/05/32-pack-batteries-1.jpeg,2024-05-28T14:29:16Z,"Are you tired of constantly running out of battery power for your remotes, game controllers, and other devices? Nows the perfect time to stock up on a trusted, reliable power source from a brand you … [+1359 chars]"
Aashna Gheewalla,"Memorial Day Sale at Home Depot: Last Chance To Get Low Prices Across Grills, Lawnmowers, Appliances and More - CNET","Memorial Day might be over but many of Home Depot's deals are still active, here's the best ones still worth getting.",https://www.cnet.com/deals/memorial-day-sale-at-home-depot-last-chance-to-get-low-prices-across-grills-lawnmowers-appliances-and-more/,https://www.cnet.com/a/img/resize/1ed19164e6745cdf29292a4f34138455e880d467/hub/2024/05/17/dcdcbf24-ab5f-426a-b96c-17db8d06b44e/home-depot-memorial-day.jpg?auto=webp&fit=crop&height=675&width=1200,2024-05-28T14:25:08Z,"Nexgrill/CNET
It's been a busy few days with Memorial Day ushering in lots of new deals and plenty of record-low prices. Thankfully, many of these offers are still live at Home Depot. So if you're p… [+3353 chars]"
finance.yahoo.com,Stock market today: Stocks open mixed as focus turns to inflation data,"US stocks opened mixed on Tuesday, with techs serving as a bright spot while Wall Street kicked off a holiday-shortened week by focusing on a coming inflation report watched closely by the Federal Reserve. The benchmark S&P 500 (^GSPC) was up about 0.2%, whil…",https://biztoc.com/x/e6eca5630cb87c72,https://c.biztoc.com/p/e6eca5630cb87c72/s.webp,2024-05-28T13:42:04Z,"US stocks opened mixed on Tuesday, with techs serving as a bright spot while Wall Street kicked off a holiday-shortened week by focusing on a coming inflation report watched closely by the Federal Re… [+298 chars]"
MacDailyNews,"How Generative AI can breathe new life into iPhones, Macs, iPads, Apple Watches, Apple TVs, HomePod, and more","Generative AI, a type of artificial intelligence that can create new data, like text, images, or videos. It works by learning the underlying…
The post How Generative AI can breathe new life into iPhones, Macs, iPads, Apple Watches, Apple TVs, HomePod, and mor…",https://macdailynews.com/2024/05/28/how-generative-ai-can-breathe-new-life-into-iphones-macs-ipads-apple-watches-apple-tvs-homepod-and-more/,https://149359564.v2.pressablecdn.com/wp-content/uploads/2024/05/240502_siri_icon.png,2024-05-28T13:33:49Z,"Generative AI, a type of artificial intelligence that can create new data, like text, images, or videos. It works by learning the underlying patterns of existing data and then using that knowledge to… [+2383 chars]"
