author,title,description,url,urlToImage,publishedAt,content
Reuters,Morning Bid: Fed in a bind as consumers stay upbeat,"World markets wobbled on Tuesday, with benchmark bond yields and volatility gauges jumping to their highest in almost four weeks, as more evidence of the...",https://finance.yahoo.com/news/morning-bid-fed-bind-consumers-101751501.html,https://media.zenfs.com/en/reuters-finance.com/81e9c50afabda00ba5eaf9b521071951,2024-05-29T10:17:51Z,"A look at the day ahead in U.S. and global markets from Mike Dolan
World markets wobbled on Tuesday, with benchmark bond yields and volatility gauges jumping to their highest in almost four weeks, a… [+4715 chars]"
barrons.com,Nvidia Stock Slips. How It Could Overtake Apple's Market Capitalization,"Nvidia’s stock rally has lifted its market capitalization to $2.848 trillion and means it is closing in on Apple, the second-largest company in the U.S. market by value.#nvidia #apple",https://biztoc.com/x/d197c05439db73fd,https://c.biztoc.com/p/d197c05439db73fd/s.webp,2024-05-29T10:02:12Z,"Nvidias stock rally has lifted its market capitalization to $2.848 trillion and means it is closing in on Apple, the second-largest company in the U.S. market by value.
#nvidia#apple
This story app… [+22 chars]"
Jonathan Bell,Nothing's first limited edition smartphone is 'a story of colour',The Nothing Phone (2a) Special Edition gets back to basics with a simple primary colour scheme to accentuate Nothing’s different design approach,https://www.wallpaper.com/tech/nothings-first-limited-edition-smartphone-is-a-story-of-colour,https://cdn.mos.cms.futurecdn.net/bdXWAwrteF9X2UFB7rDtWL-1200-80.jpg,2024-05-29T10:00:00Z,"This is the Nothing Phone (2a) Special Edition, a bold addition to the London-based tech firm’s stable of smartphones. When we traced the Phone (2a)’s design journey back at the start of the year, it… [+2673 chars]"
MarketBeat News,IAG Wealth Partners LLC Reduces Stock Position in Apple Inc. (NASDAQ:AAPL),"IAG Wealth Partners LLC reduced its stake in Apple Inc. (NASDAQ:AAPL – Free Report) by 1.1% in the fourth quarter, Holdings Channel.com reports. The fund owned 6,205 shares of the iPhone maker’s stock after selling 72 shares during the period. IAG Wealth Part…",https://www.etfdailynews.com/2024/05/29/iag-wealth-partners-llc-reduces-stock-position-in-apple-inc-nasdaqaapl/,https://www.americanbankingnews.com/wp-content/timthumb/timthumb.php?src=https://www.marketbeat.com/logos/apple-inc-logo-1200x675.png&w=240&h=240&zc=2,2024-05-29T09:38:48Z,"IAG Wealth Partners LLC reduced its stake in Apple Inc. (NASDAQ:AAPL – Free Report) by 1.1% in the fourth quarter, Holdings Channel.com reports. The fund owned 6,205 shares of the iPhone maker’s stoc… [+7057 chars]"
MarketBeat News,Markel Group Inc. Increases Position in Apple Inc. (NASDAQ:AAPL),"Markel Group Inc. grew its stake in shares of Apple Inc. (NASDAQ:AAPL – Free Report) by 0.3% in the fourth quarter, according to its most recent filing with the SEC. The institutional investor owned 1,225,890 shares of the iPhone maker’s stock after purchasin…",https://www.etfdailynews.com/2024/05/29/markel-group-inc-increases-position-in-apple-inc-nasdaqaapl/,https://www.americanbankingnews.com/wp-content/timthumb/timthumb.php?src=https://www.marketbeat.com/logos/apple-inc-logo-1200x675.png&w=240&h=240&zc=2,2024-05-29T09:38:47Z,"Markel Group Inc. grew its stake in shares of Apple Inc. (NASDAQ:AAPL – Free Report) by 0.3% in the fourth quarter, according to its most recent filing with the SEC. The institutional investor owned … [+7466 chars]"
john-anthony.disotto@futurenet.com (John-Anthony Disotto),"Make Shazam work better — upgrade your iPhone's music discovery tool with quick launch, lyrics info, and song info all without opening the app",Take Shazam to the next level with this handy shortcut that makes using the music-finding app a breeze.,https://www.imore.com/iphone/make-shazam-work-better-upgrade-your-iphones-music-discovery-tool-with-quick-launch-lyrics-info-and-song-info-all-without-opening-the-app,https://cdn.mos.cms.futurecdn.net/fgf7hgsrCiNL8JPRMJcimH-1200-80.jpg,2024-05-29T09:28:01Z,"Shazam is one of the best iPhone apps and is used by millions of people around the world on a daily basis. The music app helps you find songs you hear in public places, allowing you to add them to yo… [+2212 chars]"
MarketBeat News,Apple Inc. (NASDAQ:AAPL) is Kovack Advisors Inc.’s 2nd Largest Position,"Kovack Advisors Inc. raised its holdings in shares of Apple Inc. (NASDAQ:AAPL – Free Report) by 5.0% in the 4th quarter, according to the company in its most recent disclosure with the Securities & Exchange Commission. The firm owned 195,259 shares of the iPh…",https://www.etfdailynews.com/2024/05/29/apple-inc-nasdaqaapl-is-kovack-advisors-inc-s-2nd-largest-position/,https://www.americanbankingnews.com/wp-content/timthumb/timthumb.php?src=https://www.marketbeat.com/logos/apple-inc-logo-1200x675.png&w=240&h=240&zc=2,2024-05-29T09:04:48Z,"Kovack Advisors Inc. raised its holdings in shares of Apple Inc. (NASDAQ:AAPL – Free Report) by 5.0% in the 4th quarter, according to the company in its most recent disclosure with the Securities &am… [+7087 chars]"
MarketBeat News,Apple Inc. (NASDAQ:AAPL) Stock Holdings Raised by Citizens Financial Group Inc. RI,"Citizens Financial Group Inc. RI grew its position in shares of Apple Inc. (NASDAQ:AAPL – Free Report) by 8.5% during the fourth quarter, HoldingsChannel reports. The institutional investor owned 518,173 shares of the iPhone maker’s stock after purchasing an …",https://www.etfdailynews.com/2024/05/29/apple-inc-nasdaqaapl-stock-holdings-raised-by-citizens-financial-group-inc-ri/,https://www.americanbankingnews.com/wp-content/timthumb/timthumb.php?src=https://www.marketbeat.com/logos/apple-inc-logo-1200x675.png&w=240&h=240&zc=2,2024-05-29T09:04:47Z,"Citizens Financial Group Inc. RI grew its position in shares of Apple Inc. (NASDAQ:AAPL – Free Report) by 8.5% during the fourth quarter, HoldingsChannel reports. The institutional investor owned 518… [+7504 chars]"
MarketBeat News,Apple Inc. (NASDAQ:AAPL) Stock Holdings Cut by Eos Management L.P.,"Eos Management L.P. trimmed its position in shares of Apple Inc. (NASDAQ:AAPL – Free Report) by 9.0% during the fourth quarter, according to its most recent filing with the Securities and Exchange Commission (SEC). The fund owned 89,094 shares of the iPhone m…",https://www.etfdailynews.com/2024/05/29/apple-inc-nasdaqaapl-stock-holdings-cut-by-eos-management-l-p/,https://www.americanbankingnews.com/wp-content/timthumb/timthumb.php?src=https://www.marketbeat.com/logos/apple-inc-logo-1200x675.png&w=240&h=240&zc=2,2024-05-29T09:04:47Z,"Eos Management L.P. trimmed its position in shares of Apple Inc. (NASDAQ:AAPL – Free Report) by 9.0% during the fourth quarter, according to its most recent filing with the Securities and Exchange Co… [+7378 chars]"
MarketBeat News,Spinnaker Trust Sells 274 Shares of Apple Inc. (NASDAQ:AAPL),"Spinnaker Trust decreased its position in Apple Inc. (NASDAQ:AAPL – Free Report) by 0.1% during the 4th quarter, according to its most recent disclosure with the SEC. The fund owned 212,502 shares of the iPhone maker’s stock after selling 274 shares during th…",https://www.etfdailynews.com/2024/05/29/spinnaker-trust-sells-274-shares-of-apple-inc-nasdaqaapl/,https://www.americanbankingnews.com/wp-content/timthumb/timthumb.php?src=https://www.marketbeat.com/logos/apple-inc-logo-1200x675.png&w=240&h=240&zc=2,2024-05-29T09:04:47Z,"Spinnaker Trust decreased its position in Apple Inc. (NASDAQ:AAPL – Free Report) by 0.1% during the 4th quarter, according to its most recent disclosure with the SEC. The fund owned 212,502 shares of… [+7297 chars]"
MarketBeat News,Apple Inc. (NASDAQ:AAPL) Shares Sold by Argonautica Private Wealth Management Inc.,"Argonautica Private Wealth Management Inc. lessened its holdings in shares of Apple Inc. (NASDAQ:AAPL – Free Report) by 8.0% in the fourth quarter, according to its most recent filing with the SEC. The firm owned 70,398 shares of the iPhone maker’s stock afte…",https://www.etfdailynews.com/2024/05/29/apple-inc-nasdaqaapl-shares-sold-by-argonautica-private-wealth-management-inc/,https://www.americanbankingnews.com/wp-content/timthumb/timthumb.php?src=https://www.marketbeat.com/logos/apple-inc-logo-1200x675.png&w=240&h=240&zc=2,2024-05-29T09:04:47Z,"Argonautica Private Wealth Management Inc. lessened its holdings in shares of Apple Inc. (NASDAQ:AAPL – Free Report) by 8.0% in the fourth quarter, according to its most recent filing with the SEC. T… [+7254 chars]"
MarketBeat News,Cornerstone Capital Inc. Sells 905 Shares of Apple Inc. (NASDAQ:AAPL),"Cornerstone Capital Inc. trimmed its holdings in shares of Apple Inc. (NASDAQ:AAPL – Free Report) by 1.7% in the fourth quarter, HoldingsChannel reports. The institutional investor owned 51,606 shares of the iPhone maker’s stock after selling 905 shares durin…",https://www.etfdailynews.com/2024/05/29/cornerstone-capital-inc-sells-905-shares-of-apple-inc-nasdaqaapl/,https://www.americanbankingnews.com/wp-content/timthumb/timthumb.php?src=https://www.marketbeat.com/logos/apple-inc-logo-1200x675.png&w=240&h=240&zc=2,2024-05-29T09:04:46Z,"Cornerstone Capital Inc. trimmed its holdings in shares of Apple Inc. (NASDAQ:AAPL – Free Report) by 1.7% in the fourth quarter, HoldingsChannel reports. The institutional investor owned 51,606 share… [+6952 chars]"
MarketBeat News,Apple Inc. (NASDAQ:AAPL) Holdings Increased by KFA Private Wealth Group LLC,"KFA Private Wealth Group LLC grew its stake in shares of Apple Inc. (NASDAQ:AAPL – Free Report) by 3.1% during the fourth quarter, according to its most recent filing with the Securities and Exchange Commission. The institutional investor owned 27,656 shares …",https://www.etfdailynews.com/2024/05/29/apple-inc-nasdaqaapl-holdings-increased-by-kfa-private-wealth-group-llc/,https://www.americanbankingnews.com/wp-content/timthumb/timthumb.php?src=https://www.marketbeat.com/logos/apple-inc-logo-1200x675.png&w=240&h=240&zc=2,2024-05-29T09:04:46Z,"KFA Private Wealth Group LLC grew its stake in shares of Apple Inc. (NASDAQ:AAPL – Free Report) by 3.1% during the fourth quarter, according to its most recent filing with the Securities and Exchange… [+7274 chars]"
MarketBeat News,Blodgett Wealth Advisors LLC Decreases Stock Position in Apple Inc. (NASDAQ:AAPL),"Blodgett Wealth Advisors LLC lowered its holdings in shares of Apple Inc. (NASDAQ:AAPL – Free Report) by 0.8% during the 4th quarter, according to the company in its most recent filing with the SEC. The fund owned 70,547 shares of the iPhone maker’s stock aft…",https://www.etfdailynews.com/2024/05/29/blodgett-wealth-advisors-llc-decreases-stock-position-in-apple-inc-nasdaqaapl/,https://www.americanbankingnews.com/wp-content/timthumb/timthumb.php?src=https://www.marketbeat.com/logos/apple-inc-logo-1200x675.png&w=240&h=240&zc=2,2024-05-29T09:04:46Z,"Blodgett Wealth Advisors LLC lowered its holdings in shares of Apple Inc. (NASDAQ:AAPL – Free Report) by 0.8% during the 4th quarter, according to the company in its most recent filing with the SEC. … [+7034 chars]"
MarketBeat News,Apple Inc. (NASDAQ:AAPL) Shares Acquired by Headlands Technologies LLC,"Headlands Technologies LLC raised its position in Apple Inc. (NASDAQ:AAPL – Free Report) by 589.0% during the fourth quarter, according to its most recent filing with the SEC. The firm owned 221,926 shares of the iPhone maker’s stock after purchasing an addit…",https://www.etfdailynews.com/2024/05/29/apple-inc-nasdaqaapl-shares-acquired-by-headlands-technologies-llc/,https://www.americanbankingnews.com/wp-content/timthumb/timthumb.php?src=https://www.marketbeat.com/logos/apple-inc-logo-1200x675.png&w=240&h=240&zc=2,2024-05-29T09:04:46Z,"Headlands Technologies LLC raised its position in Apple Inc. (NASDAQ:AAPL – Free Report) by 589.0% during the fourth quarter, according to its most recent filing with the SEC. The firm owned 221,926 … [+7064 chars]"
MarketBeat News,Darrow Company Inc. Acquires New Position in Apple Inc. (NASDAQ:AAPL),"Darrow Company Inc. bought a new position in Apple Inc. (NASDAQ:AAPL – Free Report) in the fourth quarter, according to the company in its most recent 13F filing with the SEC. The fund bought 2,219 shares of the iPhone maker’s stock, valued at approximately $…",https://www.etfdailynews.com/2024/05/29/darrow-company-inc-acquires-new-position-in-apple-inc-nasdaqaapl/,https://www.americanbankingnews.com/wp-content/timthumb/timthumb.php?src=https://www.marketbeat.com/logos/apple-inc-logo-1200x675.png&w=240&h=240&zc=2,2024-05-29T09:04:46Z,"Darrow Company Inc. bought a new position in Apple Inc. (NASDAQ:AAPL – Free Report) in the fourth quarter, according to the company in its most recent 13F filing with the SEC. The fund bought 2,219 s… [+7345 chars]"
MarketBeat News,Apple Inc. (NASDAQ:AAPL) Shares Sold by Boyd Watterson Asset Management LLC OH,"Boyd Watterson Asset Management LLC OH lowered its holdings in shares of Apple Inc. (NASDAQ:AAPL – Free Report) by 0.7% in the fourth quarter, according to the company in its most recent filing with the Securities and Exchange Commission (SEC). The firm owned…",https://www.etfdailynews.com/2024/05/29/apple-inc-nasdaqaapl-shares-sold-by-boyd-watterson-asset-management-llc-oh/,https://www.americanbankingnews.com/wp-content/timthumb/timthumb.php?src=https://www.marketbeat.com/logos/apple-inc-logo-1200x675.png&w=240&h=240&zc=2,2024-05-29T08:18:42Z,"Boyd Watterson Asset Management LLC OH lowered its holdings in shares of Apple Inc. (NASDAQ:AAPL – Free Report) by 0.7% in the fourth quarter, according to the company in its most recent filing with … [+7343 chars]"
MarketBeat News,Bahl & Gaynor Inc. Decreases Stock Position in Apple Inc. (NASDAQ:AAPL),"Bahl & Gaynor Inc. reduced its position in Apple Inc. (NASDAQ:AAPL – Free Report) by 1.2% in the fourth quarter, according to the company in its most recent filing with the Securities and Exchange Commission (SEC). The fund owned 872,488 shares of the iPhone …",https://www.etfdailynews.com/2024/05/29/bahl-gaynor-inc-decreases-stock-position-in-apple-inc-nasdaqaapl/,https://www.americanbankingnews.com/wp-content/timthumb/timthumb.php?src=https://www.marketbeat.com/logos/apple-inc-logo-1200x675.png&w=240&h=240&zc=2,2024-05-29T08:18:41Z,"Bahl &amp; Gaynor Inc. reduced its position in Apple Inc. (NASDAQ:AAPL – Free Report) by 1.2% in the fourth quarter, according to the company in its most recent filing with the Securities and Exchang… [+6810 chars]"
Roxane Nojac,Taiwan & TSMC: Linked fate,"(marketscreener.com) Taiwan's stock market is doing very well. With the exception of the Nasdaq, it is outperforming its major global peers, be they American, Chinese or European, with TSMC as a main engine. https://www.marketscreener.com/news/latest/Taiwan-T…",https://www.marketscreener.com/news/latest/Taiwan-TSMC-Linked-fate-46849351/,https://www.zonebourse.com/images/ImagesTagged/zbimg_3178447_800.png,2024-05-29T08:07:34Z,"Since the artificial intelligence craze invaded the markets, Taipei has been experiencing a massive and unusual influx of capital. Eager to capitalize on the strength and prospects of Taiwan Semicond… [+1575 chars]"
Adam Oram,Memorial Day Sales Aren't Over Yet: This Could Be the Final Day for These Huge Discounts - CNET,"We're approaching the end of the Memorial Day sales, so act fast to save big.",https://www.cnet.com/deals/best-memorial-day-sales-2024-05-29/,https://www.cnet.com/a/img/resize/b2252f5677e77b9e0eb7dd3829d7cc6d77ca3af6/hub/2024/05/22/d0511dd0-2137-4eaf-823f-8e6a76d2575c/memorial-day.png?auto=webp&fit=crop&height=675&width=1200,2024-05-29T08:02:00Z,"While Memorial Day might be over, that doesn't mean the deals are all over, at least not quite yet. That's because you can still get some pretty decent discounts on everything from TVs and smart home… [+50629 chars]"
Nick Cawley,Market Latest – Nvidia (NVDA) Surge Helps the Nasdaq 100 Post a Fresh Record High,"AI mega-stock Nvidia leapt by 7% in US trade, helping push the Nasdaq 100 to a fresh record closing high. The US dollar remains subdued ahead of Friday’s US inflation release.",https://www.dailyfx.com/news/market-latest-nvidia-nvda-surge-helps-the-nasdaq-100-post-a-fresh-record-high-20240529.html,https://a.c-dn.net/b/1TUQqX/bullish+chart.png,2024-05-29T07:59:44Z,"Nvidia (NVDA), Nasdaq 100, US Dollar Charts and Analysis
<ul><li>Nvidia now worth USD2.8 trillion after latest rally.</li><li>US dollar and gold tread water ahead of Fridays Core PCE release.</li></… [+2575 chars]"
MarketBeat News,Hyatt Hotels Co. (NYSE:H) Given Average Rating of “Hold” by Analysts,"Shares of Hyatt Hotels Co. (NYSE:H – Get Free Report) have been assigned an average rating of “Hold” from the sixteen analysts that are currently covering the stock, Marketbeat.com reports. Ten research analysts have rated the stock with a hold recommendation…",https://www.etfdailynews.com/2024/05/29/hyatt-hotels-co-nyseh-given-average-rating-of-hold-by-analysts/,https://www.americanbankingnews.com/wp-content/timthumb/timthumb.php?src=https://www.marketbeat.com/logos/hyatt-hotels-co-logo-1200x675.png?v=20221109133308&w=240&h=240&zc=2,2024-05-29T07:24:42Z,"Shares of Hyatt Hotels Co. (NYSE:H – Get Free Report) have been assigned an average rating of “Hold” from the sixteen analysts that are currently covering the stock, Marketbeat.com reports. Ten resea… [+6071 chars]"
Reuters,AI darling Nvidia's market value surges closer to Apple,"Nvidia's shares surged 6% to a record high, nearing Apple's market value of $2.9 trillion. The AI chipmaker's stock hit $1,128, up 8% during the session, driven by strong second-quarter revenue forecasts and a stock split.",https://economictimes.indiatimes.com/markets/stocks/news/ai-darling-nvidias-market-value-surges-closer-to-apple/articleshow/110517976.cms,"https://img.etimg.com/thumb/msid-110518069,width-1200,height-630,imgsize-102804,overlay-etmarkets/photo.jpg",2024-05-29T03:00:36Z,"Nvidia's shares rallied around 6% to hit a record high on Tuesday, leaving the AI chipmaker's stock market value about $100 billion away from overtaking Apple in a major reshuffle of Wall street's bi… [+2516 chars]"
Mitchell Lawler,Record highs! Is it too late to buy the Nasdaq 100 (NDQ) ETF on the ASX?,"AI mania is taking the tech-centric index to new heights. Should investors hold off on buying into the local Nasdaq ETF?
The post Record highs! Is it too late to buy the Nasdaq 100 (NDQ) ETF on the ASX? appeared first on The Motley Fool Australia.",https://www.fool.com.au/2024/05/29/record-highs-is-it-too-late-to-buy-the-nasdaq-100-ndq-etf-on-the-asx/,https://www.fool.com.au/wp-content/uploads/2023/09/top-10-1200x675.jpg,2024-05-29T02:31:23Z,"While we were asleep last night, a momentous milestone occurred at the other end of the planet. 
Wall Street's tech cathedral, the Nasdaq Composite Index (NASDAQ: .IXIC), firmly planted its flag bey… [+2258 chars]"
japantimes.co.jp,AI darling Nvidia's market value surges closer to Apple,"Nvidia's shares rallied around 6% to hit a record high on Tuesday, leaving the AI chipmaker's stock market value about $100 billion away from overtaking Apple in a major reshuffle of Wall Street's biggest players. Last trading at $1,128, Nvidia's market capit…",https://biztoc.com/x/9166df07b1f82963,https://c.biztoc.com/p/9166df07b1f82963/s.webp,2024-05-29T02:06:09Z,"Nvidia's shares rallied around 6% to hit a record high on Tuesday, leaving the AI chipmaker's stock market value about $100 billion away from overtaking Apple in a major reshuffle of Wall Street's bi… [+227 chars]"
TipRanks,"At 67x Earnings, Chipotle Stock (NYSE:CMG) Is a Market Anomaly","Chipotle Mexican Grill (NYSE:CMG) owns and operates over 3,400 Mexican restaurants across five different countries. Investors have bid up its shares to 67x...",https://finance.yahoo.com/news/67x-earnings-chipotle-stock-nyse-015110770.html,https://media.zenfs.com/en/tipranks_452/58a6c7deff6a17ff0f140f565f3ea032,2024-05-29T01:51:10Z,"Chipotle Mexican Grill (NYSE:CMG) owns and operates over 3,400 Mexican restaurants across five different countries. Investors have bid up its shares to 67x earnings, touting the companys growth, driv… [+5209 chars]"
tipranks.com,Gains as iPhone Shipments Soar in China - TipRanks.com,"Apple (NASDAQ:AAPL) stock was trading 2.4% higher at the time of writing. The upside comes after AAPL witnessed a significant rebound in China, with iPhone shipments jumping 52% year-over-year in April, according to Bloomberg. This marks two consecutive month…",https://biztoc.com/x/045ffbea4c7388e2,https://c.biztoc.com/p/045ffbea4c7388e2/og.webp,2024-05-29T01:30:06Z,"Apple (NASDAQ:AAPL) stock was trading 2.4% higher at the time of writing. The upside comes after AAPL witnessed a significant rebound in China, with iPhone shipments jumping 52% year-over-year in Apr… [+272 chars]"
Reuters,"Nasdaq closes above 17,000; S&P 500 slightly higher, Dow down","Nasdaq crossed 17,000 for the first time boosted by Nvidia, while S&P 500 closed higher and Dow lower as Treasury yields rose.",https://economictimes.indiatimes.com/markets/stocks/news/nasdaq-closes-above-17000-sp-500-slightly-higher-dow-down/articleshow/110516640.cms,"https://img.etimg.com/thumb/msid-110516654,width-1200,height-630,imgsize-170576,overlay-etmarkets/photo.jpg",2024-05-29T01:29:47Z,"The Nasdaq crossed 17,000 for the first time ever on Tuesday, boosted by gains in Nvidia, while the S&amp;P 500 closed barely higher and the Dow ended lower as Treasury yields rose.Nvidia jumped 7% a… [+3090 chars]"
finance.yahoo.com,First Solar Stock (NASDAQ:FSLR): Cheaply Valued and Benefiting from AI,"First Solar (NASDAQ:FSLR), a global solar energy solutions provider headquartered in Arizona, is a cheaply valued AI beneficiary that had been ignored by the market until recently. FSLR stock soared more than 30% between May 20 and 22 based on two pieces of n…",https://biztoc.com/x/f0aacf9e35d1ecd2,https://c.biztoc.com/p/f0aacf9e35d1ecd2/s.webp,2024-05-29T01:08:05Z,"First Solar (NASDAQ:FSLR), a global solar energy solutions provider headquartered in Arizona, is a cheaply valued AI beneficiary that had been ignored by the market until recently. FSLR stock soared … [+277 chars]"
Oliver Haslam,"Best Apple Memorial Day Sales: You Can Still Score Savings on iPads, Macs, AirPods and More - CNET",Grab these popular devices before these deals disappear.,https://www.cnet.com/deals/best-apple-memorial-day-sales-2024-05-28/,https://www.cnet.com/a/img/resize/adc47a1f7daf76132323ac1e6ce799af1b5c1eaa/hub/2024/05/23/5b0b434c-60c6-4176-a8aa-82e12fe7bf4c/apple-memorial-day-deals.jpg?auto=webp&fit=crop&height=675&width=1200,2024-05-28T22:45:00Z,"Memorial Day has come and gone, but if you've been debating when to splurge on new Apple products, now is as good a time as any. Apple itself may not have the price cuts you're looking for, but other… [+2472 chars]"
Bloomberg News,Asian Stocks to Trend Lower After Treasuries Drop: Markets Wrap,"Stocks in Asia were mostly set to decline after a US session dominated by a sell-off in bonds, with traders also weighing mixed economic data and remarks from Federal Reserve speakers for clues on the policy outlook.",https://financialpost.com/pmn/business-pmn/asian-stocks-to-trend-lower-after-treasuries-drop-markets-wrap,https://smartcdn.gprod.postmedia.digital/financialpost/wp-content/uploads/2024/05/us-core-inflation-seen-cooling-a-touch-feds-preferred-gauge.jpg,2024-05-28T22:38:05Z,"Stocks in Asia were mostly set to decline after a US session dominated by a sell-off in bonds, with traders also weighing mixed economic data and remarks from Federal Reserve speakers for clues on th… [+8742 chars]"
Zaheer Kachwala,AI darling Nvidia's market value surges closer to Apple,"Nvidia's shares rallied around 6% to hit a record high on Tuesday, leaving the AI chipmaker's stock market value about $100 billion away from overtaking Apple in a major reshuffle of Wall Street's biggest players.",https://www.japantimes.co.jp/business/2024/05/29/companies/ai-nvidia-value-apple/,https://www.japantimes.co.jp/japantimes/uploads/images/2024/05/29/399748.JPG,2024-05-28T22:38:00Z,"Nvidia's shares rallied around 6% to hit a record high on Tuesday, leaving the AI chipmaker's stock market value about $100 billion away from overtaking Apple in a major reshuffle of Wall Street's bi… [+357 chars]"
finance.yahoo.com,Stock market today: Nasdaq hits record ahead of new inflation data,None The Nasdaq hit a record in early trading on Tuesday while other indexes were mixed. • None Markets will also digest housing data and revised GDP numbers for the first quarter. Stocks were mixed on Tuesday with the Nasdaq hitting records in early trading …,https://biztoc.com/x/ff2b2ddb46a97be2,https://c.biztoc.com/p/ff2b2ddb46a97be2/s.webp,2024-05-28T22:34:05Z,None The Nasdaq hit a record in early trading on Tuesday while other indexes were mixed.None Markets will also digest housing data and revised GDP numbers for the first quarter.Stocks were mixed on T… [+300 chars]
