author,title,description,url,urlToImage,publishedAt,content
finance.yahoo.com,These 5 Artificial Intelligence (AI) Stocks Make Up 27.3% of the Entire S&P 500 Index,"The S&P 500 (SNPINDEX: ^GSPC) is composed of 500 stocks from 11 different sectors, including information technology, energy, financials, and real estate. While it is the most diversified of the major U.S. stock market indexes, a select few technology stocks a…",https://biztoc.com/x/43cf64505435529d,https://c.biztoc.com/p/43cf64505435529d/s.webp,2024-05-28T22:20:06Z,"The S&amp;P 500 (SNPINDEX: ^GSPC) is composed of 500 stocks from 11 different sectors, including information technology, energy, financials, and real estate. While it is the most diversified of the m… [+278 chars]"
Reuters,Musk offers factory tours to investors as he seeks support for his pay package,Musk offers factory tours to investors as he seeks support for his pay package,https://www.investing.com/news/stock-market-news/musk-offers-factory-tours-to-investors-as-he-seeks-support-for-his-pay-package-3459990,https://i-invdn-com.investing.com/news/LYNXMPEA6606G_L.jpg,2024-05-28T21:46:29Z,"By Hyunjoo Jin
SAN FRANCISCO (Reuters) - Elon Musk is offering factory tours to 15 Tesla (NASDAQ:TSLA) shareholders who vote on his $56 billion pay package at the upcoming meeting, the latest effort… [+2148 chars]"
MacDailyNews,Nvidia’s market value surges closer to Apple,"Nvidia's shares rallied around 6% to hit a record high on Tuesday, leaving the AI chipmaker's stock market value about $100 billion away…
The post Nvidia’s market value surges closer to Apple appeared first on MacDailyNews.",https://macdailynews.com/2024/05/28/nvidias-market-value-surges-closer-to-apple/,https://149359564.v2.pressablecdn.com/wp-content/uploads/2021/12/211207_stock_chart.png,2024-05-28T21:16:41Z,"Nvidia’s shares rallied around 6% to hit a record high on Tuesday, leaving the AI chipmaker’s stock market value about $100 billion away from overtaking Apple in a significant reshuffling of Wall Str… [+1615 chars]"
luke.hughes@futurenet.com (Luke Hughes),"Nvidia CEO net worth soars to new high — but Jensen Huang is still some way behind Bill Gates, Jeff Bezos and Elon Musk","Huang claims his company is ‘shaking up computing’, but capitalism, clearly, is going as planned.",https://www.techradar.com/pro/nvidia-ceo-net-worth-soars-to-new-high-but-jensen-huang-is-still-some-way-behind-bill-gates-jeff-bezos-and-elon-musk,https://cdn.mos.cms.futurecdn.net/m3ESE7Xy2s54PQtLswoLgn-1200-80.jpg,2024-05-28T21:16:00Z,"In terrific news for brand defenders everywhere, Jensen Huang, Chief Executive Officer (CEO) of computer hardware manufacturer Nvidia, has seen his net worth spiral from $3 billion to $90 billion ove… [+1918 chars]"
investorplace.com,"If You Can Only Buy One Penny Stock in May, It Better Be One of These 3 Names",Here are just a few top penny stocks to buy and hold long term Penny stocks carry a great deal of risk. It’s why investors are often told to steer clear of them. Many penny stocks typically trade over the counter and rarely on a major exchange. And about 90% …,https://biztoc.com/x/17a14eb6696c6802,https://c.biztoc.com/p/17a14eb6696c6802/s.webp,2024-05-28T21:00:09Z,Here are just a few top penny stocks to buy and hold long termPenny stocks carry a great deal of risk. Its why investors are often told to steer clear of them.Many penny stocks typically trade over t… [+293 chars]
finance.yahoo.com,"Stock market today: Nvidia, Nasdaq reach record highs as AI rally continues","The tech-heavy Nasdaq Composite (^IXIC) reached a new high on Tuesday, breaching 17,000 for the first time as AI darling Nvidia (NVDA) continued its post-earnings tear to also reach a record of $1,140 a share. The benchmark S&P 500 (^GSPC) finished the day ju…",https://biztoc.com/x/1852a4da474452c0,https://c.biztoc.com/p/1852a4da474452c0/og.webp,2024-05-28T20:50:07Z,"The tech-heavy Nasdaq Composite (^IXIC) reached a new high on Tuesday, breaching 17,000 for the first time as AI darling Nvidia (NVDA) continued its post-earnings tear to also reach a record of $1,14… [+296 chars]"
Lindsay Landis,"Classic Strawberry Jam, 3 Ways (Old Fashioned, Regular Pectin, and Low-Sugar Pectin)","Homemade strawberry jam is perfect in its simplicity, bright and sweet and bursting with strawberry flavor, no matter if you water-bath process it for shelf stable storage, refrigerate or freeze it, or eat it straight out of the jar with a spoon. This post is…",https://www.loveandoliveoil.com/2024/05/classic-strawberry-jam-3-ways.html,https://www.loveandoliveoil.com/wp-content/uploads/2024/05/classic-strawberry-jam-FEAT.jpg,2024-05-28T20:45:19Z,"Homemade strawberry jam is perfect in its simplicity, bright and sweet and bursting with strawberry flavor, no matter if you water-bath process it for shelf stable storage, refrigerate or freeze it, … [+30762 chars]"
Devra First,"In Boston, omakase is having a moment","As sushi tasting menus gain popularity, more chefs are opening restaurants specializing in the format.",https://www.bostonglobe.com/2024/05/28/lifestyle/omakase-boston-sushi-restaurants/,https://bostonglobe-prod.cdn.arcpublishing.com/resizer/zbWFUqS_A0LAGT8tEqai_-kDAvs=/506x0/cloudfront-us-east-1.images.arcpublishing.com/bostonglobe/OJXALLQQBOF2ZKV5JZQAFLZZLM.jpg,2024-05-28T20:44:21Z,"This evening the meal begins with kegani, horsehair crab from Hokkaido, served with caviar, wobbly jelly made from the stock dashi, and its own rich tomalley, in a white, shell-shaped dish traced wit… [+11099 chars]"
Reuters,AI darling Nvidia’s market value surges closer to Apple,"Nvidia's shares rallied around 6% to hit a record high on Tuesday, leaving the AI chipmaker's stock market value about $100 billion away from overtaking Apple in a major reshuffle of Wall Street's biggest players.",https://nypost.com/2024/05/28/business/ai-darling-nvidias-market-value-surges-closer-to-apple/,https://nypost.com/wp-content/uploads/sites/2/2024/05/newspress-collage-b8noi2o2v-1716928956252.jpg?quality=75&strip=all&1716914563&w=1024,2024-05-28T20:43:38Z,"Nvidia’s shares rallied around 6% to hit a record high on Tuesday, leaving the AI chipmaker’s stock market value about $100 billion away from overtaking Apple in a major reshuffle of Wall Street’s bi… [+2817 chars]"
investing.com,"Stock Market Today: Nasdaq closes above 17,000 for first time as Nvidia shines By","Investing.com -- The Nasdaq closed above 17,000 for the first time ever Tuesday, underpinned by a surge in Nvidia amid ongoing AI-led optimism. At 16:00 ET (20:00 GMT), rose 0.6% to close at a record of 17,019.88, the fell 216 points, or 0.6%, while rose 0.1%…",https://biztoc.com/x/3265c0dc77da9f5f,https://c.biztoc.com/p/3265c0dc77da9f5f/s.webp,2024-05-28T20:32:05Z,"Investing.com -- The Nasdaq closed above 17,000 for the first time ever Tuesday, underpinned by a surge in Nvidia amid ongoing AI-led optimism.At 16:00 ET (20:00 GMT), rose 0.6% to close at a record … [+300 chars]"
"Derek Saul, Forbes Staff, 
 Derek Saul, Forbes Staff
 https://www.forbes.com/sites/dereksaul/",Nvidia CEO Huang Briefly A $100 Billion Man As AI Firm Closes In On Apple,"Following its $600 billion explosion over the last month, Nvidia’s market capitalization is within $110 billion of Apple’s to become the second-biggest company in the world.",https://www.forbes.com/sites/dereksaul/2024/05/28/nvidia-ceo-huang-briefly-a-100-billion-man-as-ai-firm-closes-in-on-apple/,"https://imageio.forbes.com/specials-images/imageserve/6656385d68f31d3b932989e3/0x0.jpg?format=jpg&crop=3173,1786,x0,y56,safe&height=900&width=1600&fit=bounds",2024-05-28T20:29:30Z,"Nvidia stocks rally to yet another major milestone Tuesday made its CEO Jensen Huang a centibillionaire for part of Tuesday afternoon, as the artificial intelligence technology architect closes in on… [+3121 chars]"
finance.yahoo.com,"Stock market today: Nvidia, Nasdaq reach record highs as AI rally continues","The tech-heavy Nasdaq Composite (^IXIC) reached a new high on Tuesday, breaching 17,000 for the first time as AI darling Nvidia (NVDA) continued its post-earnings tear to also reach a record of $1,140 a share. The benchmark S&P 500 (^GSPC) finished the day ju…",https://biztoc.com/x/8ef5736b9951e74c,https://c.biztoc.com/p/8ef5736b9951e74c/s.webp,2024-05-28T20:14:06Z,"The tech-heavy Nasdaq Composite (^IXIC) reached a new high on Tuesday, breaching 17,000 for the first time as AI darling Nvidia (NVDA) continued its post-earnings tear to also reach a record of $1,14… [+296 chars]"
P.J. McCormick,Save up to 40% off AA and AAA Energizer Batteries today on Amazon,A deal to get charged up about!,https://nypost.com/2024/05/28/shopping/energizer-aa-and-aaa-batteries-are-up-to-40-off-on-amazon/,https://nypost.com/wp-content/uploads/sites/2/2024/05/aaafeat.jpg?quality=75&strip=all&w=1024,2024-05-28T19:38:28Z,"New York Post may be compensated and/or receive an affiliate commission if you buy through our links.
It’s human to forget about the little things. 
If we didn’t, we wouldn’t be constantly reminded… [+2038 chars]"
Reuters,AI darling Nvidia's market value surges closer to Apple,AI darling Nvidia's market value surges closer to Apple,https://www.investing.com/news/stock-market-news/ai-darling-nvidias-market-value-surges-closer-to-apple-3459652,https://i-invdn-com.investing.com/news/LYNXMPEB440WA_L.jpg,2024-05-28T19:25:40Z,"By Zaheer Kachwala
(Reuters) - Nvidia (NASDAQ:NVDA)'s shares rallied around 6% to hit a record high on Tuesday, leaving the AI chipmaker's stock market value about $100 billion away from overtaking … [+2597 chars]"
Zaheer Kachwala,AI darling Nvidia's market value surges closer to Apple,"Nvidia's shares rallied around 6% to hit a record high on Tuesday, leaving the AI chipmaker's stock market value about $100 billion away from overtaking...",https://finance.yahoo.com/news/ai-darling-nvidias-market-value-191307625.html,https://media.zenfs.com/en/reuters-finance.com/b36108250fcb575fed3e6fd0ea486b1f,2024-05-28T19:13:07Z,"By Zaheer Kachwala
(Reuters) - Nvidia's shares rallied around 6% to hit a record high on Tuesday, leaving the AI chipmaker's stock market value about $100 billion away from overtaking Apple in a maj… [+2640 chars]"
"Rashi Shrivastava, Forbes Staff, 
 Rashi Shrivastava, Forbes Staff
 https://www.forbes.com/sites/rashishrivastava/",The Prompt: Google’s AI Suggested Adding Glue To Pizza,Plus: OpenAI is already training its next model.,https://www.forbes.com/sites/rashishrivastava/2024/05/28/the-prompt-googles-ai-suggested-adding-glue-to-pizza/,"https://imageio.forbes.com/specials-images/imageserve/6656287be34edaf1424fc490/0x0.jpg?format=jpg&crop=960,540,x0,y49,safe&height=900&width=1600&fit=bounds",2024-05-28T18:59:21Z,"The Prompt is a weekly rundown of AIs buzziest startups, biggest breakthroughs, and business deals. To get it in your inbox, subscribe here.
Welcome back to The Prompt.
Today, OpenAI announced that… [+6781 chars]"
Daniel Miessler,UL NO. 434: Can You Articulate Yourself in 50 Words?,"NetworkChuck's Fabric Video, Algorithms Replace Degrees, AI Transparency, New Grad Difficulty, Windows Goes Full AI, and more…",https://danielmiessler.com/p/ul-434,https://beehiiv-images-production.s3.amazonaws.com/uploads/asset/file/3fe82512-2cd4-426f-9d2b-e93cb1a4029e/434.png?t=1716496476,2024-05-28T18:16:57Z,"Continue reading online to avoid the email cutoff issue
SECURITY | AI | MEANING :: Unsupervised Learning is a website, newsletter, and podcast about how to survive and thrive as humans in a post-AI … [+17506 chars]"
investors.com,Nvidia Stock Eyes These Milestones After AI Leader Surges Above 1000,"continues to skyrocket, surging last week above the 1,000 level for the first time last week. Its market cap raced past $2.5 trillion, less than a year after reaching the $1 trillion mark. Shares are still rising Tuesday. With the artificial intelligence lead…",https://biztoc.com/x/c638f965c37da334,https://c.biztoc.com/p/c638f965c37da334/og.webp,2024-05-28T18:16:09Z,"continues to skyrocket, surging last week above the 1,000 level for the first time last week. Its market cap raced past $2.5 trillion, less than a year after reaching the $1 trillion mark. Shares are… [+288 chars]"
finance.yahoo.com,Stock market today: Stocks mixed as focus turns to inflation data,"US stocks were mixed in afternoon trading on Tuesday, with techs serving as a bright spot while Wall Street kicked off a holiday-shortened week by focusing on a coming inflation report watched closely by the Federal Reserve. The benchmark S&P 500 (^GSPC) hugg…",https://biztoc.com/x/7a8e423ced90ba6d,https://c.biztoc.com/p/7a8e423ced90ba6d/s.webp,2024-05-28T18:08:04Z,"US stocks were mixed in afternoon trading on Tuesday, with techs serving as a bright spot while Wall Street kicked off a holiday-shortened week by focusing on a coming inflation report watched closel… [+290 chars]"
bradypsnyder@gmail.com (Brady Snyder),"Annual Wear OS version upgrades will make each one a lot more boring, and that's okay","Samsung could release a Wear OS 5 beta soon, and it got me thinking about how much less exciting Wear OS updates will be moving forward.",https://www.androidcentral.com/wearables/wear-os-5-beta-imminent-signals-boring-yearly-releases,https://cdn.mos.cms.futurecdn.net/KMzN7iY7rxuGGoswFWw5xQ-1200-80.jpg,2024-05-28T18:01:58Z,"What you need to know
<ul><li>Google confirmed that Wear OS 5 is coming with a developer session at Google I/O earlier this month.</li><li>Wear OS releases, which are built in a collaboration betwee… [+5815 chars]"
thedailyupside.com,Midday Market Brief: The Nasdaq Touches a New High,"Hello, and welcome to the inaugural edition of The Daily Upside’s Midday Market Brief. The idea here is simple: a quick but comprehensive snapshot of the day’s market somewhere close to the halfway point of the trading session. We don’t quite have a motto yet…",https://biztoc.com/x/5264621f1d5d63dd,https://c.biztoc.com/p/5264621f1d5d63dd/s.webp,2024-05-28T17:12:13Z,"Hello, and welcome to the inaugural edition of The Daily Upsides Midday Market Brief.The idea here is simple: a quick but comprehensive snapshot of the days market somewhere close to the halfway poin… [+297 chars]"
Aashna Gheewalla,"Best Memorial Day Walmart Sales: Save Today on Tech, TVs, Home and More - CNET","Walmart still has major Memorial Day discounts on top brands like Apple, Samsung, LG, KitchenAid, Sony and Nintendo.",https://www.cnet.com/deals/best-memorial-day-walmart-sales-save-today-on-tech-tvs-home-and-more/,https://www.cnet.com/a/img/resize/242463f6d79f2def080876eacd72353e90c02530/hub/2024/05/22/ef261ab7-cbe4-4e08-bd91-8b44722c945f/2022-apple-10-9-inch-ipad-air-md.png?auto=webp&fit=crop&height=675&width=1200,2024-05-28T17:09:00Z,"The Samsung Frame TV is now discounted at Walmart.
Samsung/CNET
If you forgot to shop this weekend, then don't worry. Major retailers, like Walmart, are winding down their Memorial Day sales events… [+2640 chars]"
Nadine DeNinno,Meet the best-dressed man on Wall Street,"Globally-known tech analyst Dan Ives has become a fashion legend. He's stopped all around the world, recognized for his financial know-how — as well as his eye-popping fashion.",https://nypost.com/2024/05/28/lifestyle/meet-the-best-dressed-man-on-wall-street/,https://nypost.com/wp-content/uploads/sites/2/2024/05/best-dressed-man-wall-street-81430473.jpg?quality=75&strip=all&w=1024,2024-05-28T17:01:01Z,"On Wall Street, where pressed collars, Patagonia vests and brown loafers reign supreme, Wedbush Securities Dan Ives stands out.
While some may still imagine FiDis best-dressed as a Gucci-clad Gordon… [+7905 chars]"
thedailyupside.com,Midday Market Brief: The Nasdaq Touches a New High,"Hello, and welcome to the inaugural edition of The Daily Upside’s Midday Market Brief. The idea here is simple: a quick but comprehensive snapshot of the day’s market somewhere close to the halfway point of the trading session. We don’t quite have a motto yet…",https://biztoc.com/x/b9445706522b211c,https://c.biztoc.com/p/b9445706522b211c/s.webp,2024-05-28T17:00:06Z,"Hello, and welcome to the inaugural edition of The Daily Upsides Midday Market Brief.The idea here is simple: a quick but comprehensive snapshot of the days market somewhere close to the halfway poin… [+296 chars]"
washingtonpost.com,Apple and Microsoft want you to notice how their AI works. But why?,"Technology has wormed its way into your life partly because you don’t have to think about how it works. You summon an Uber car, create a digital calendar appointment that family members can see, or order a blender that Target’s website shows is in stock. You …",https://biztoc.com/x/d7a43b9ceb02914f,https://c.biztoc.com/p/d7a43b9ceb02914f/s.webp,2024-05-28T16:46:30Z,"Technology has wormed its way into your life partly because you dont have to think about how it works.You summon an Uber car, create a digital calendar appointment that family members can see, or ord… [+206 chars]"
Shira Ovide,Apple and Microsoft use AI to sell complex tech. Ignore the gibberish.,Companies want you to care about the distinction between “on device” and cloud artificial intelligence. You just want technology to work.,https://www.washingtonpost.com/technology/2024/05/24/apple-microsoft-ai-products-events/,https://www.washingtonpost.com/wp-apps/imrs.php?src=https://arc-anglerfish-washpost-prod-washpost.s3.amazonaws.com/public/FNOVM6YKBVFG3OEN6ZYSHHW5FQ.jpg&w=1440,2024-05-28T16:39:47Z,"Technology has wormed its way into your life partly because you dont have to think about how it works.
You summon an Uber car, create a digital calendar appointment that family members can see, or o… [+150 chars]"
Kayode Omotosho,Why DraftKings (DKNG) Stock Is Down Today,Shares of fantasy sports and betting company DraftKings (NASDAQ:DKNG) fell 13% in the afternoon session as betting stocks took a hit after the Illinois State...,https://finance.yahoo.com/news/why-draftkings-dkng-stock-down-163738187.html,https://s.yimg.com/ny/api/res/1.2/08Lh0Arhf65vSkTfpz3SyQ--/YXBwaWQ9aGlnaGxhbmRlcjt3PTEyMDA7aD02MDA-/https://media.zenfs.com/en/stockstory_922/1675ab1a394bdf01490b430c78dde20b,2024-05-28T16:37:38Z,"Why DraftKings (DKNG) Stock Is Down Today
What Happened:
Shares of fantasy sports and betting company DraftKings (NASDAQ:DKNG) fell 13% in the afternoon session as betting stocks took a hit after t… [+1526 chars]"
Quentyn Kennemer,The 10th-gen iPad drops to $300 for the first time,"The latest iPad is $50 off at Amazon, marking a new low. Samsung’s Galaxy Buds 2 and Apple’s leather AirTag Loops are also on sale.",https://www.theverge.com/2024/5/28/24166180/amazon-apple-ipad-samsung-galaxy-buds-2-deal-sale,https://cdn.vox-cdn.com/thumbor/o2eZ-UI17WzzB0FGKz23I7FMzUE=/0x0:2040x1360/1200x628/filters:focal(1020x680:1021x681)/cdn.vox-cdn.com/uploads/chorus_asset/file/24128002/226361_Apple_iPad_10.9_10th_gen_DSeifert_0001.jpg,2024-05-28T16:12:02Z,"The 10th-gen iPad drops to $300 for the first time
The 10th-gen iPad drops to $300 for the first time
 / Samsungs Galaxy Buds 2 and Apples discontinued leather AirTag Loops are also down to all-tim… [+2514 chars]"
Adrian Marlow,"Best Buy Memorial Day Finds on Apple, Samsung, Dyson and More Products You'll Enjoy - CNET","You won't want to miss the tail end of Best Buy's Memorial Day sale, which is still offering big discounts on TVs, phones, laptops and more.",https://www.cnet.com/deals/best-buy-memorial-day-sale-24-05-28/,https://www.cnet.com/a/img/resize/21da7ad046d56d55b757de6d02eb9510016e934a/hub/2024/05/24/71ec6be7-0e8d-49fe-af3e-5980a5405e66/samsung-oled-commerce-image.jpg?auto=webp&fit=crop&height=675&width=1200,2024-05-28T16:11:00Z,"Samsung/CNET
Memorial Day is the perfect time to find deals at major retailers like Amazon, Walmart and Best Buy, but if you missed out on the main event, there are still some lingering deals you ca… [+3035 chars]"
Stephen Warwick,The Twelve South HoverBar Duo is two brilliant iPad stands for the price of one,The Twelve South HoverBar Duo is back with a second iteration that's even better than the first.,https://www.imore.com/ipad/twelvesouth-hoverbar-duo-2-review,https://cdn.mos.cms.futurecdn.net/9a9FdFvvq3hjbdxjsbt36a-1200-80.jpg,2024-05-28T16:03:18Z,"We absolutely love Twelve South’s HoverBar Duo. It’s one of the best iPad stands on the market thanks to its excellent, flexible design, and its great build quality. Now, the HoverBar Duo is back in … [+4894 chars]"
Ryan Stevens,On theCUBE Pod: Nvidia’s new breakthrough and the latest in open source,"The computing industry is witnessing a future shift toward AI-powered, Arm-based PCs, marking a transition from traditional x86 architecture. There are ongoing battles in the middleware layer of technology, particularly involving open-source platforms. Expert…",https://siliconangle.com/2024/05/28/john-furrier-dave-vellante-nvidia-open-source-thecubepod/,https://d15shllkswkct0.cloudfront.net/wp-content/blogs.dir/1/files/2024/05/Dave-Vellante-and-John-Furrier-theCUBE-Podcast-24-May-2024.png,2024-05-28T15:56:41Z,"The computing industry is witnessing a future shift toward AI-powered, Arm-based PCs, marking a transition from traditional x86 architecture. There are ongoing battles in the middleware layer of tech… [+6655 chars]"
Jason R. Rich,Best barbecue grill deals of May 2024,"BBQ season is finally here. If you're shopping for a new grill this summer, now is a smart time to save some cash.",https://www.cbsnews.com/essentials/best-summer-barbecue-grill-deals/,https://assets1.cbsnewsstatic.com/hub/i/r/2024/04/23/887355ac-cdc2-4607-928d-ad660905a061/thumbnail/1200x630/423f8d6faa8852e0ccd382a0a47ce297/grill-deals-hero.jpg?v=83093a0dd27502f0a52cd68b1c5b8b6e,2024-05-28T15:55:31Z,"Kamado Joe
Now that Memorial Day weekend is in the books, summer is (unofficially) here. That means a few things: Longer days, warmer nights and -- of course -- BBQ grilling season.
This year, you … [+11648 chars]"
Justin Kahn,"Apple’s 256GB 13-inch M2 iPad Air hits all-time low, iPad 10th Gen now $300, Apple Watch Ultra 2 Alpine $714, more","While there are still a number of hangover Memorial Day Apple deals floating around in our massive roundup you’ll find right here, some new offers have popped up this morning as well. First up, we have a straight up $50 price drop on Apple’s new 13-inch M2 iP…",https://9to5mac.com/2024/05/28/m2-ipad-air-deals-apple-watch-ultra-2/,https://i0.wp.com/9to5mac.com/wp-content/uploads/sites/6/2024/05/m2-ipad-air-vs-ipad-10-displays.jpeg?resize=1200%2C628&quality=82&strip=all&ssl=1,2024-05-28T15:54:22Z,"While there are still a number of hangover Memorial Day Apple deals floating around in our massive roundup you’ll find right here, some new offers have popped up this morning as well. First up, we ha… [+3458 chars]"
Investing.com,"Midday movers: Nvidia, Apple and GameStop rise; Tesla, DraftKings fall","Midday movers: Nvidia, Apple and GameStop rise; Tesla, DraftKings fall",https://www.investing.com/news/stock-market-news/nvidia-apple-and-gamestop-rise-premarket-tesla-draftkings-fall-3458576,https://i-invdn-com.investing.com/news/moved_LYNXNPEK1L0CN_L.jpg,2024-05-28T15:45:05Z,"Investing.com -- U.S. stock futures edged higher Tuesday, starting the holiday-shortened week on a positive note ahead of the release of more key inflation data.Here are some of the biggest U.S. stoc… [+1665 chars]"
fool.com,"1 Unstoppable Stock That Could Join Nvidia, Microsoft, Apple, Amazon, Alphabet, and Meta in the $1 Trillion Club",This semiconductor stock is all set to grow rapidly in the coming years. The U.S. stock market has demonstrated remarkable resilience and growth over the past decade despite multiple economic challenges and geopolitical pressures. This environment has helped …,https://biztoc.com/x/fe4d8ca7b08c6123,https://c.biztoc.com/p/fe4d8ca7b08c6123/og.webp,2024-05-28T15:28:06Z,This semiconductor stock is all set to grow rapidly in the coming years.The U.S. stock market has demonstrated remarkable resilience and growth over the past decade despite multiple economic challeng… [+277 chars]
Steven Guglielmi,Who Will Survive a Shakeout in the Electric Vehicle Market?,"The edge goes to vertically integrated EV makers like Tesla and China’s BYD, along with legacy automakers and well-funded startups, according to Wharton’s John Paul MacDuffie.…Read More",https://knowledge.wharton.upenn.edu/article/who-will-survive-a-shakeout-in-the-electric-vehicle-market/,https://knowledge.wharton.upenn.edu/wp-content/uploads/2024/05/5.29.24-john-paul-macduffie-why-ev-startups-fail-GettyImages-1356150834-600x500.jpg,2024-05-28T15:23:20Z,"The ongoing deceleration in demand for electric vehicles is an early warning signal of a shakeout in the nascent industry, according to Wharton management professor John Paul MacDuffie, who is also d… [+6731 chars]"
finance.yahoo.com,Stock market today: Stocks mixed as focus turns to inflation data,"US stocks were mixed in early trading on Tuesday, with techs serving as a bright spot while Wall Street kicked off a holiday-shortened week by focusing on a coming inflation report watched closely by the Federal Reserve. The benchmark S&P 500 (^GSPC) hugged t…",https://biztoc.com/x/8be642138dd7f5de,https://c.biztoc.com/p/8be642138dd7f5de/og.webp,2024-05-28T15:12:14Z,"US stocks were mixed in early trading on Tuesday, with techs serving as a bright spot while Wall Street kicked off a holiday-shortened week by focusing on a coming inflation report watched closely by… [+299 chars]"
